<?xml version="1.0" encoding="UTF-8"?>
<!DOCTYPE key SYSTEM "../key.dtd">

<key ref="Ichneumon-females-A1" doc_ref="Hilpert-1992" lang="de">

  <title>Gruppe A1</title>

  <singlet ref="1" else_ref="4">
    <property>
      Große Arten (13,2-15,5)
    </property>
  </singlet>

  <singlet ref="2" else_ref="3">
    <property>
      TiIII apikal zu 1/4 schwarz.
    </property>
    <taxon>
      I. xanthorius FORSTER
    </taxon>
  </singlet>

  <singlet ref="3" else_ref="2">
    <property>
      TiIII apikal nicht schwarz, nur wenig rot
    </property>
    <taxon>
      I. sexcinctus GRAVENHORST
    </taxon>
  </singlet>

  <singlet ref="4" else_ref="1">
    <property>
      Kleinere Art (bis 11,6).
    </property>
    <property>
      (Scutellum oft nicht ganz weiß, weißer Fleck nur nierenförmig.)
    </property>
    <taxon>
      I. ostentator HEINRICH
    </taxon>
  </singlet>

</key>
